{
  "schema_version": 1,
  "kind": "generic_ai_approval_trace",
  "trace_id": "trace-generic-approval-deny-trading-order-001",
  "fixture_key": "generic.ai.approval.policy:trace:deny:trading_order:v1",
  "provider_free": true,
  "live_network": false,
  "real_dependency_imports": false,
  "request": {
    "request_id": "req-submit-order-001",
    "tool": "send_order",
    "capability": "generic.ai.capability.trading.order_submit",
    "risk_level": "critical",
    "args_shape": {
      "id": "string"
    }
  },
  "policy": {
    "package": "generic.ai.approval.policy",
    "default_decision": "deny",
    "exact_capability_match_required": true,
    "allowed_capabilities": []
  },
  "decision": {
    "status": "denied",
    "reason": "critical trading capability requires an exact approval grant",
    "approval_required": true,
    "approval_id": null
  },
  "result": {
    "status": "denied",
    "executed": false,
    "side_effects": false,
    "secret_values_present": false
  },
  "replay": {
    "mode": "fixture_replay",
    "deterministic": true,
    "fixture_sha256": "sha256:fixture-placeholder-generic-approval-trace",
    "created_from_provider": false
  }
}
